no,text,favorited,favoriteCount,replyToSN,created,truncated,replyToSID,id,replyToUID,statusSource,screenName,retweetCount,isRetweet,retweeted,longitude,latitude,,,,,,,,,,,,,,,,,,,,,,,,,,,,,,,,,,
48,Feeling like you might have the flu? It's important to start antiviral treatments within 48 hrs of onset. Call your…,FALSE,4,NA,3/4/19 0:25,TRUE,NA,1.10E+18,NA,"<a href=\https://sproutsocial.com\"" rel=\""nofollow\"">Sprout Social</a>""",AAFANational,3,FALSE,FALSE,NA,NA,,,,,,,,,,,,,,,,,,,,,,,,,,,,,,,,,,
49,@jimmyfallon Gets a #Flu Shot from The Masked Vaccinator @DrOz#LeadingByExample,FALSE,0,jimmyfallon,3/4/19 0:00,TRUE,NA,1.10E+18,15485441,"<a href=\https://www.hootsuite.com\"" rel=\""nofollow\"">Hootsuite Inc.</a>""",NFIDvaccines,0,FALSE,FALSE,NA,NA,,,,,,,,,,,,,,,,,,,,,,,,,,,,,,,,,,
50,WATCH: Draft prospect Quinnen Williams is faster than NFC West QBs via @cards_wire Our…,FALSE,3,NA,3/3/19 20:25,TRUE,NA,1.10E+18,NA,"<a href=\http://twitter.com\"" rel=\""nofollow\"">Twitter Web Client</a>""",outlandtrophy,0,FALSE,FALSE,NA,NA,,,,,,,,,,,,,,,,,,,,,,,,,,,,,,,,,,
51,How do we #FightFlu? The best way we know how: conducting solid research. We strive to improve #flu prevention stra…,FALSE,7,NA,3/3/19 18:41,TRUE,NA,1.10E+18,NA,"<a href=\https://sproutsocial.com\"" rel=\""nofollow\"">Sprout Social</a>""",abtassociates,2,FALSE,FALSE,NA,NA,,,,,,,,,,,,,,,,,,,,,,,,,,,,,,,,,,
52,Winter Health Myths Busted! Spoiler alert: the flu shot does not give you the #flu via…,FALSE,1,NA,3/3/19 18:30,TRUE,NA,1.10E+18,NA,"<a href=\https://www.hootsuite.com\"" rel=\""nofollow\"">Hootsuite Inc.</a>""",NFIDvaccines,2,FALSE,FALSE,NA,NA,,,,,,,,,,,,,,,,,,,,,,,,,,,,,,,,,,
53,Our 2018 @outlandtrophy recipient. #FightFlu and @NFIDvaccines.,FALSE,10,NA,3/3/19 17:27,FALSE,NA,1.10E+18,NA,"<a href=\https://mobile.twitter.com\"" rel=\""nofollow\"">Twitter Web App</a>""",outlandtrophy,5,FALSE,FALSE,NA,NA,,,,,,,,,,,,,,,,,,,,,,,,,,,,,,,,,,
54,Laura Scott served as our ED until her passing on 3/3/15. Her love and support helped our families through our grie…,FALSE,13,NA,3/3/19 17:12,TRUE,NA,1.10E+18,NA,"<a href=\https://sproutsocial.com\"" rel=\""nofollow\"">Sprout Social</a>""",famfightflu,4,FALSE,FALSE,NA,NA,,,,,,,,,,,,,,,,,,,,,,,,,,,,,,,,,,
55,Senior Life: Did you know #influenza complications can include heart attack and stroke?,FALSE,4,NA,3/3/19 15:15,TRUE,NA,1.10E+18,NA,"<a href=\https://www.hootsuite.com\"" rel=\""nofollow\"">Hootsuite Inc.</a>""",NFIDvaccines,3,FALSE,FALSE,NA,NA,,,,,,,,,,,,,,,,,,,,,,,,,,,,,,,,,,
56,Is it a cold or #flu? Learn more: #GetVaccinated to help #FightFlu,FALSE,2,NA,3/3/19 14:30,FALSE,NA,1.10E+18,NA,"<a href=\https://www.hootsuite.com\"" rel=\""nofollow\"">Hootsuite Inc.</a>""",NFIDvaccines,1,FALSE,FALSE,NA,NA,,,,,,,,,,,,,,,,,,,,,,,,,,,,,,,,,,
57,One of our three 2018 @outlandtrophy finalists. #FightFlu and @NFIDvaccines.,FALSE,4,NA,3/3/19 1:34,FALSE,NA,1.10E+18,NA,"<a href=\https://mobile.twitter.com\"" rel=\""nofollow\"">Twitter Web App</a>""",outlandtrophy,2,FALSE,FALSE,NA,NA,,,,,,,,,,,,,,,,,,,,,,,,,,,,,,,,,,
58,What’s it like trying to block Quinnen Williams?,FALSE,5,NA,3/3/19 1:26,TRUE,NA,1.10E+18,NA,"<a href=\http://twitter.com\"" rel=\""nofollow\"">Twitter Web Client</a>""",outlandtrophy,2,FALSE,FALSE,NA,NA,,,,,,,,,,,,,,,,,,,,,,,,,,,,,,,,,,
59,"#REPOST via nicoleburron (IG) I still have a lot to get done, so I can't risk getting the flu. That's why I got my…",FALSE,0,NA,3/2/19 22:59,TRUE,NA,1.10E+18,NA,"<a href=\https://www.socialreport.com\"" rel=\""nofollow\"">SocialReport.com</a>""",stopflunow,0,FALSE,FALSE,NA,NA,,,,,,,,,,,,,,,,,,,,,,,,,,,,,,,,,,
60,Winter is here and so is the flu! Know the symptoms and fight the flu this season with helpful information at…,FALSE,1,NA,3/2/19 20:05,TRUE,NA,1.10E+18,NA,"<a href=\https://www.hootsuite.com\"" rel=\""nofollow\"">Hootsuite Inc.</a>""",SMWesterly,0,FALSE,FALSE,NA,NA,,,,,,,,,,,,,,,,,,,,,,,,,,,,,,,,,,
61,Need help finding where to #getyourflushot? Visit the link provided to locate the nearest place to get the flu vac…,FALSE,0,NA,3/2/19 17:29,TRUE,NA,1.10E+18,NA,"<a href=\https://www.socialreport.com\"" rel=\""nofollow\"">SocialReport.com</a>""",stopflunow,0,FALSE,FALSE,NA,NA,,,,,,,,,,,,,,,,,,,,,,,,,,,,,,,,,,
62,Our 1987 @outlandtrophy recipient. #FightFlu and @NFIDvaccines.,FALSE,8,NA,3/2/19 15:30,FALSE,NA,1.10E+18,NA,"<a href=\https://mobile.twitter.com\"" rel=\""nofollow\"">Twitter Web App</a>""",outlandtrophy,2,FALSE,FALSE,NA,NA,,,,,,,,,,,,,,,,,,,,,,,,,,,,,,,,,,
63,"@CDCFlu While you #FightFlu, you can #PlayFlu too at",FALSE,0,CDCFlu,3/2/19 2:08,FALSE,1.10E+18,1.10E+18,16616061,"<a href=\http://twitter.com\"" rel=\""nofollow\"">Twitter Web Client</a>""",glorkiogame,0,FALSE,FALSE,NA,NA,,,,,,,,,,,,,,,,,,,,,,,,,,,,,,,,,,
64,Flu has taken over! Play to experience it from a new perspective. #FightFlu #PlayFlu,FALSE,0,NA,3/2/19 2:06,FALSE,NA,1.10E+18,NA,"<a href=\http://twitter.com\"" rel=\""nofollow\"">Twitter Web Client</a>""",glorkiogame,0,FALSE,FALSE,NA,NA,,,,,,,,,,,,,,,,,,,,,,,,,,,,,,,,,,
66,Can Houston's Ed Oliver break paradigms like Kyler Murray? via @YahooCASports…,FALSE,2,NA,3/1/19 23:15,TRUE,NA,1.10E+18,NA,"<a href=\http://twitter.com\"" rel=\""nofollow\"">Twitter Web Client</a>""",outlandtrophy,1,FALSE,FALSE,NA,NA,,,,,,,,,,,,,,,,,,,,,,,,,,,,,,,,,,
67,".@JonahGWilliams of @AlabamaFTBL, one of three 2018 @outlandtrophy finalists. #FightFlu and @NFIDVaccines.",FALSE,1,NA,3/1/19 21:46,FALSE,NA,1.10E+18,NA,"<a href=\http://twitter.com\"" rel=\""nofollow\"">Twitter Web Client</a>""",outlandtrophy,0,FALSE,FALSE,NA,NA,,,,,,,,,,,,,,,,,,,,,,,,,,,,,,,,,,
68,".@JonahGWilliams of @AlabamaFTBL, one of three 2018 @OutlandTrophy finalists. #FightFlu and @NFIDVaccines.",FALSE,1,NA,3/1/19 21:41,FALSE,NA,1.10E+18,NA,"<a href=\http://twitter.com\"" rel=\""nofollow\"">Twitter Web Client</a>""",outlandtrophy,0,FALSE,FALSE,NA,NA,,,,,,,,,,,,,,,,,,,,,,,,,,,,,,,,,,
69,#FluFactFriday: Recent studies show flu shots cut hospital risk during pregnancy. Learn more about Abt’s…,FALSE,0,NA,3/1/19 21:06,TRUE,NA,1.10E+18,NA,"<a href=\https://sproutsocial.com\"" rel=\""nofollow\"">Sprout Social</a>""",abtassociates,1,FALSE,FALSE,NA,NA,,,,,,,,,,,,,,,,,,,,,,,,,,,,,,,,,,
70,Flu strains are circulating across the U.S. with 48 states reporting widespread flu activity. The @CDCgov estimates…,FALSE,2,NA,3/1/19 19:51,TRUE,NA,1.10E+18,NA,"<a href=\http://twitter.com\"" rel=\""nofollow\"">Twitter Web Client</a>""",UFHealthNews,0,FALSE,FALSE,NA,NA,,,,,,,,,,,,,,,,,,,,,,,,,,,,,,,,,,
71,CDC flu report: 15 more children have died. Story at #FightFlu #VaccinesWork,FALSE,1,NA,3/1/19 18:25,FALSE,NA,1.10E+18,NA,"<a href=\https://www.hootsuite.com\"" rel=\""nofollow\"">Hootsuite Inc.</a>""",AAPNews,3,FALSE,FALSE,NA,NA,,,,,,,,,,,,,,,,,,,,,,,,,,,,,,,,,,
72,"It's still #fluseason! Remember, if you're caring for children, prevent spread of #flu. Call your…",FALSE,0,NA,3/1/19 18:00,TRUE,NA,1.10E+18,NA,"<a href=\https://buffer.com\"" rel=\""nofollow\"">Buffer</a>""",SNHDflu,0,FALSE,FALSE,NA,NA,,,,,,,,,,,,,,,,,,,,,,,,,,,,,,,,,,
73,One of the most challenging moments of my pregnancy was when I was battling the flu. Get the flu shot. This is a ho…,FALSE,3,NA,3/1/19 17:56,TRUE,NA,1.10E+18,NA,"<a href=\http://twitter.com/download/iphone\"" rel=\""nofollow\"">Twitter for iPhone</a>""",frankieBRLA,1,FALSE,FALSE,NA,NA,,,,,,,,,,,,,,,,,,,,,,,,,,,,,,,,,,
74,#REPOST via IG: xmiahxtrinityx The flu is most dangerous for children and the elderly.— Don’t be a statistic in 20…,FALSE,0,NA,3/1/19 17:05,TRUE,NA,1.10E+18,NA,"<a href=\https://www.socialreport.com\"" rel=\""nofollow\"">SocialReport.com</a>""",stopflunow,1,FALSE,FALSE,NA,NA,,,,,,,,,,,,,,,,,,,,,,,,,,,,,,,,,,
75,A key study has found NO link between flu shot and miscarriage. Experts recommend that pregnant women receive a flu…,FALSE,7,NA,3/1/19 15:46,TRUE,NA,1.10E+18,NA,"<a href=\https://sproutsocial.com\"" rel=\""nofollow\"">Sprout Social</a>""",MODAdvocacy,2,FALSE,FALSE,NA,NA,,,,,,,,,,,,,,,,,,,,,,,,,,,,,,,,,,
76,"Flu is widespread in Cook County, but the good news is it is never too late to get a flu shot! #FightFlu",FALSE,0,NA,3/1/19 15:10,FALSE,NA,1.10E+18,NA,"<a href=\http://twitter.com\"" rel=\""nofollow\"">Twitter Web Client</a>""",CookCtyHealth,0,FALSE,FALSE,NA,NA,,,,,,,,,,,,,,,,,,,,,,,,,,,,,,,,,,
77,"GERMS BEWARE! @nationalpta and lysol just donated 10 cases of wipes to our school, so we’re ready to #fightflu 💙 @…",FALSE,6,NA,3/1/19 14:11,TRUE,NA,1.10E+18,NA,"<a href=\http://instagram.com\"" rel=\""nofollow\"">Instagram</a>""",FolksPta,1,FALSE,FALSE,-98.73589947,29.53564288,,,,,,,,,,,,,,,,,,,,,,,,,,,,,,,,,,
78,"#FluFactFriday: As a possible second wave of #influenza is reported, remember the consequences of the #flu are more…",FALSE,0,NA,3/1/19 14:06,TRUE,NA,1.10E+18,NA,"<a href=\https://buffer.com\"" rel=\""nofollow\"">Buffer</a>""",MedPedsAllergy,0,FALSE,FALSE,NA,NA,,,,,,,,,,,,,,,,,,,,,,,,,,,,,,,,,,
79,"CDC estimates that there have been as many as 22,300 flu-associated deaths so far this season (between Oct. 1, 2018…",FALSE,0,NA,3/1/19 0:00,TRUE,NA,1.10E+18,NA,"<a href=\https://www.hootsuite.com\"" rel=\""nofollow\"">Hootsuite Inc.</a>""",GreeneCoPH,0,FALSE,FALSE,NA,NA,,,,,,,,,,,,,,,,,,,,,,,,,,,,,,,,,,
80,"Studies show that vaccine strains grown in eggs tend to mutate over time and that cell-based flu vaccines, which 1s…",FALSE,5,NA,2/28/19 23:18,TRUE,NA,1.10E+18,NA,"<a href=\https://sproutsocial.com\"" rel=\""nofollow\"">Sprout Social</a>""",famfightflu,0,FALSE,FALSE,NA,NA,,,,,,,,,,,,,,,,,,,,,,,,,,,,,,,,,,
81,"Caregivers: Children younger than 6 months are at high risk of serious flu complications, but are too young to get…",FALSE,2,NA,2/28/19 23:01,TRUE,NA,1.10E+18,NA,"<a href=\https://buffer.com\"" rel=\""nofollow\"">Buffer</a>""",HeadStartgov,2,FALSE,FALSE,NA,NA,,,,,,,,,,,,,,,,,,,,,,,,,,,,,,,,,,
82,"It's still flu season. The best way to protect yourself is to get immunized, cover your cough, and wash your hands.…",FALSE,2,NA,2/28/19 21:55,TRUE,NA,1.10E+18,NA,"<a href=\https://www.hootsuite.com\"" rel=\""nofollow\"">Hootsuite Inc.</a>""",AHS_CentralZone,1,FALSE,FALSE,NA,NA,,,,,,,,,,,,,,,,,,,,,,,,,,,,,,,,,,
83,"The @CDCgov's vaccine committee just discussed flu vaccine effectiveness, its safety for pregnant women and revisio…",FALSE,10,NA,2/28/19 21:50,TRUE,NA,1.10E+18,NA,"<a href=\https://www.hootsuite.com\"" rel=\""nofollow\"">Hootsuite Inc.</a>""",AAPNews,7,FALSE,FALSE,NA,NA,,,,,,,,,,,,,,,,,,,,,,,,,,,,,,,,,,
84,"Congratulations and thank you to @jake7bunz who, along with teammate Will Johnson, helped @DHSWI promote the import…",FALSE,1,NA,2/28/19 18:21,TRUE,NA,1.10E+18,NA,"<a href=\https://about.twitter.com/products/tweetdeck\"" rel=\""nofollow\"">TweetDeck</a>""",DHSWI,0,FALSE,FALSE,NA,NA,,,,,,,,,,,,,,,,,,,,,,,,,,,,,,,,,,
85,Atlantic Ultraviolet Has Installed a Sanitaire UV-C Room Air Sanitizer to Protect Occupants from Infection due to F…,FALSE,0,NA,2/28/19 18:05,TRUE,NA,1.10E+18,NA,"<a href=\https://coschedule.com\"" rel=\""nofollow\"">CoSchedule</a>""",AtlanticUVCorp,0,FALSE,FALSE,NA,NA,,,,,,,,,,,,,,,,,,,,,,,,,,,,,,,,,,
86,#FluFact: #Handwashing is one of the simplest ways to prevent the spread of #flu and other illnesses. There is a ri…,FALSE,1,NA,2/28/19 18:02,TRUE,NA,1.10E+18,NA,"<a href=\https://buffer.com\"" rel=\""nofollow\"">Buffer</a>""",SNHDflu,0,FALSE,FALSE,NA,NA,,,,,,,,,,,,,,,,,,,,,,,,,,,,,,,,,,
87,"If you have #heartdisease, take 3 actions to #FightFlu. 1. Get your flu vaccine. 2. Take everyday preventive act…",FALSE,0,NA,2/28/19 14:53,TRUE,NA,1.10E+18,NA,"<a href=\http://twitter.com\"" rel=\""nofollow\"">Twitter Web Client</a>""",rosscohealth,0,FALSE,FALSE,NA,NA,,,,,,,,,,,,,,,,,,,,,,,,,,,,,,,,,,
90,The best way to prevent a worldwide #flu pandemic starts with solid research. Learn how our infectious disease ex…,FALSE,4,NA,2/28/19 13:05,TRUE,NA,1.10E+18,NA,"<a href=\https://sproutsocial.com\"" rel=\""nofollow\"">Sprout Social</a>""",abtassociates,3,FALSE,FALSE,NA,NA,,,,,,,,,,,,,,,,,,,,,,,,,,,,,,,,,,
91,@jillpromoli @4jude4everyone @celliottability @GinettePT @CanPaedSociety @ImmunizedotCa @ChelseaClinton…,FALSE,3,jillpromoli,2/28/19 1:58,TRUE,1.10E+18,1.10E+18,32871593,"<a href=\http://twitter.com/download/android\"" rel=\""nofollow\"">Twitter for Android</a>""",NursesWhoVax,0,FALSE,FALSE,NA,NA,,,,,,,,,,,,,,,,,,,,,,,,,,,,,,,,,,
92,DT Williams to skip bench press at combine - #GoogleAlerts Our 2018 @OutlandTrophy recipien…,FALSE,0,NA,2/28/19 1:08,TRUE,NA,1.10E+18,NA,"<a href=\http://twitter.com\"" rel=\""nofollow\"">Twitter Web Client</a>""",outlandtrophy,0,FALSE,FALSE,NA,NA,,,,,,,,,,,,,,,,,,,,,,,,,,,,,,,,,,
93,Glad to see that legislators are getting their briefings from #flu experts. We support the quest for a universal f…,FALSE,4,NA,2/27/19 20:22,TRUE,NA,1.10E+18,NA,"<a href=\https://www.hootsuite.com\"" rel=\""nofollow\"">Hootsuite Inc.</a>""",famfightflu,1,FALSE,FALSE,NA,NA,,,,,,,,,,,,,,,,,,,,,,,,,,,,,,,,,,
94,"Are sneezes and sniffles a sign of a cold or flu? Both are contagious and can have similar symptoms. However, colds…",FALSE,12,NA,2/27/19 18:28,TRUE,NA,1.10E+18,NA,"<a href=\https://www.hootsuite.com\"" rel=\""nofollow\"">Hootsuite Inc.</a>""",CAPublicHealth,10,FALSE,FALSE,NA,NA,,,,,,,,,,,,,,,,,,,,,,,,,,,,,,,,,,
95,#DYK how #flu vaccines are made? Our own Dr. Len Friedland goes #behindthescience w/ @PeiSzeCheng4NY of @NBCNewYork…,FALSE,8,NA,2/27/19 18:23,TRUE,NA,1.10E+18,NA,"<a href=\https://prod1.sprinklr.com\"" rel=\""nofollow\"">Sprinklr Publishing</a>""",GSKUS,4,FALSE,FALSE,NA,NA,,,,,,,,,,,,,,,,,,,,,,,,,,,,,,,,,,
96,"@CrispinCuttino While the single best way to #fightflu is to get vaccinated, everyday preventive actions are an imp…",FALSE,1,CDCFlu,2/27/19 18:03,TRUE,1.10E+18,1.10E+18,16616061,"<a href=\http://twitter.com\"" rel=\""nofollow\"">Twitter Web Client</a>""",CDCFlu,0,FALSE,FALSE,NA,NA,,,,,,,,,,,,,,,,,,,,,,,,,,,,,,,,,,
97,"“Don’t worry, I woke up feeling better. I’m not sick.” The Center for Disease Control and Prevention says people w…",FALSE,7,NA,2/27/19 17:23,TRUE,NA,1.10E+18,NA,"<a href=\https://sproutsocial.com\"" rel=\""nofollow\"">Sprout Social</a>""",NationalPTA,10,FALSE,FALSE,NA,NA,,,,,,,,,,,,,,,,,,,,,,,,,,,,,,,,,,
98,#REPOST via IG: jazmyn_amethyst There’s no way I’m letting the flu ruin my travel plans and neither should you! It…,FALSE,0,NA,2/27/19 17:20,TRUE,NA,1.10E+18,NA,"<a href=\https://www.socialreport.com\"" rel=\""nofollow\"">SocialReport.com</a>""",stopflunow,0,FALSE,FALSE,NA,NA,,,,,,,,,,,,,,,,,,,,,,,,,,,,,,,,,,
99,The #ACIP reports recent licensure changes in regard to #flu vaccines for young children. #FightFlu,FALSE,1,NA,2/27/19 17:11,FALSE,NA,1.10E+18,NA,"<a href=\https://www.hootsuite.com\"" rel=\""nofollow\"">Hootsuite Inc.</a>""",famfightflu,1,FALSE,FALSE,NA,NA,,,,,,,,,,,,,,,,,,,,,,,,,,,,,,,,,,
100,Want to help your body fight off the flu? Get better sleep. #sleep #flu #fightflu #virus #health…,FALSE,2,NA,2/27/19 17:04,TRUE,NA,1.10E+18,NA,"<a href=\https://buffer.com\"" rel=\""nofollow\"">Buffer</a>""",MIRAPartners,1,FALSE,FALSE,NA,NA,,,,,,,,,,,,,,,,,,,,,,,,,,,,,,,,,,
101,#ACIP #flu update: @WHO has made their recommendation for flu virus selection for the 2019-2020 influenza season. A…,FALSE,2,NA,2/27/19 16:04,TRUE,NA,1.10E+18,NA,"<a href=\https://www.hootsuite.com\"" rel=\""nofollow\"">Hootsuite Inc.</a>""",famfightflu,1,FALSE,FALSE,NA,NA,,,,,,,,,,,,,,,,,,,,,,,,,,,,,,,,,,
102,"Like winter, ❄️ flu season isn’t over yet. If flu's caught up to you remember to cough or sneeze into the bend of…",FALSE,4,NA,2/27/19 15:55,TRUE,NA,1.10E+18,NA,"<a href=\https://www.hootsuite.com\"" rel=\""nofollow\"">Hootsuite Inc.</a>""",CPHO_Canada,1,FALSE,FALSE,NA,NA,,,,,,,,,,,,,,,,,,,,,,,,,,,,,,,,,,
103,Think the flu season is over? Think again! But it's not too late to protect yourself &amp; everyone around you from ser…,FALSE,0,NA,2/27/19 15:55,TRUE,NA,1.10E+18,NA,"<a href=\https://about.twitter.com/products/tweetdeck\"" rel=\""nofollow\"">TweetDeck</a>""",DHSWI,0,FALSE,FALSE,NA,NA,,,,,,,,,,,,,,,,,,,,,,,,,,,,,,,,,,
104,"#DYK: During the 2017-2018 #flu season, 185 children died due to flu and related complications? Download the #NFID…",FALSE,1,NA,2/27/19 15:30,TRUE,NA,1.10E+18,NA,"<a href=\https://www.hootsuite.com\"" rel=\""nofollow\"">Hootsuite Inc.</a>""",NFIDvaccines,1,FALSE,FALSE,NA,NA,,,,,,,,,,,,,,,,,,,,,,,,,,,,,,,,,,
105,Want to learn more about #personalhealth? ✔ this out. #NHES Std. 1 and Std. 7 #fightflu,FALSE,0,NA,2/27/19 11:56,FALSE,NA,1.10E+18,NA,"<a href=\http://twitter.com/download/android\"" rel=\""nofollow\"">Twitter for Android</a>""",slsshonna,0,FALSE,FALSE,NA,NA,,,,,,,,,,,,,,,,,,,,,,,,,,,,,,,,,,
106,"“Jude died from influenza B. The flu. That doesn’t sound so bad, right? Just an ordinary illness that everyone gets…",FALSE,17,NA,2/27/19 3:32,TRUE,NA,1.10E+18,NA,"<a href=\http://twitter.com/download/iphone\"" rel=\""nofollow\"">Twitter for iPhone</a>""",drfixus,4,FALSE,FALSE,NA,NA,,,,,,,,,,,,,,,,,,,,,,,,,,,,,,,,,,
107,Flu is unpredictable! H1N1 has been the dominant flu strain this season but reports indicate that H3N2 now account…,FALSE,4,NA,2/27/19 2:11,TRUE,NA,1.10E+18,NA,"<a href=\https://sproutsocial.com\"" rel=\""nofollow\"">Sprout Social</a>""",famfightflu,4,FALSE,FALSE,NA,NA,,,,,,,,,,,,,,,,,,,,,,,,,,,,,,,,,,
108,\An infant from North Jersey died from #flu complications in January,".. the third child in New Jersey to die from f…""",FALSE,10,NA,2/27/19 0:30,TRUE,NA,1.10E+18,NA,"<a href=\http://www.facebook.com/twitter\"" rel=\""nofollow\"">Facebook</a>""",DrPanMD,4,FALSE,FALSE,NA,NA,,,,,,,,,,,,,,,,,,,,,,,,,,,,,,,,,
109,Our Twitter Takeover highlighting children and flu with Dr. Swanson has been postponed. A new date and time for thi…,FALSE,25,NA,2/27/19 0:28,TRUE,NA,1.10E+18,NA,"<a href=\http://twitter.com\"" rel=\""nofollow\"">Twitter Web Client</a>""",CDCFlu,14,FALSE,FALSE,NA,NA,,,,,,,,,,,,,,,,,,,,,,,,,,,,,,,,,,
110,North Gwinnett grad Mitch Hyatt lives in the moment while preparing for the NFL Combine -,FALSE,4,NA,2/26/19 23:16,TRUE,NA,1.10E+18,NA,"<a href=\http://twitter.com\"" rel=\""nofollow\"">Twitter Web Client</a>""",outlandtrophy,3,FALSE,FALSE,NA,NA,,,,,,,,,,,,,,,,,,,,,,,,,,,,,,,,,,
111,"#REPOST via IG: lepashandi If you still need to #getyourflushot, it’s not too late! Up to 50 million in the US get…",FALSE,1,NA,2/26/19 23:09,TRUE,NA,1.10E+18,NA,"<a href=\https://www.socialreport.com\"" rel=\""nofollow\"">SocialReport.com</a>""",stopflunow,1,FALSE,FALSE,NA,NA,,,,,,,,,,,,,,,,,,,,,,,,,,,,,,,,,,
112,UH's Ed Oliver expected to dominate NFL scouting combine,FALSE,7,NA,2/26/19 23:09,TRUE,NA,1.10E+18,NA,"<a href=\http://twitter.com\"" rel=\""nofollow\"">Twitter Web Client</a>""",outlandtrophy,2,FALSE,FALSE,NA,NA,,,,,,,,,,,,,,,,,,,,,,,,,,,,,,,,,,
113,"If you are planning to visit the hospital, please be aware that flu restrictions are in place. These restrictions,…",FALSE,5,NA,2/26/19 21:28,TRUE,NA,1.10E+18,NA,"<a href=\http://twitter.com\"" rel=\""nofollow\"">Twitter Web Client</a>""",dukeraleigh,1,FALSE,FALSE,NA,NA,,,,,,,,,,,,,,,,,,,,,,,,,,,,,,,,,,
114,"Did you know that even as a young, healthy adult, you can still be very susceptible to the flu? Check out the video…",FALSE,1,NA,2/26/19 21:00,TRUE,NA,1.10E+18,NA,"<a href=\https://about.twitter.com/products/tweetdeck\"" rel=\""nofollow\"">TweetDeck</a>""",healthycampus,0,FALSE,FALSE,NA,NA,,,,,,,,,,,,,,,,,,,,,,,,,,,,,,,,,,
115,"Fever, aches, and cough? It could mean #flu. Review the full list of symptoms and see your doctor if you are very…",FALSE,8,NA,2/26/19 19:01,TRUE,NA,1.10E+18,NA,"<a href=\https://studio.twitter.com\"" rel=\""nofollow\"">Twitter Media Studio</a>""",CDCDirector,7,FALSE,FALSE,NA,NA,,,,,,,,,,,,,,,,,,,,,,,,,,,,,,,,,,
116,#TwitterTakeover Alert! Tune in tomorrow at 10:30 am ET/7:30 am PT for pediatrician @SeattleMamaDoc’s takeover of…,FALSE,18,NA,2/26/19 18:32,TRUE,NA,1.10E+18,NA,"<a href=\https://sproutsocial.com\"" rel=\""nofollow\"">Sprout Social</a>""",CDCgov,10,FALSE,FALSE,NA,NA,,,,,,,,,,,,,,,,,,,,,,,,,,,,,,,,,,
117,"#FluTip: If you are at high risk for #flu complications, your #healthcareprovider can prescribe antiviral medicatio…",FALSE,0,NA,2/26/19 18:12,TRUE,NA,1.10E+18,NA,"<a href=\https://buffer.com\"" rel=\""nofollow\"">Buffer</a>""",TuSNHD,0,FALSE,FALSE,NA,NA,,,,,,,,,,,,,,,,,,,,,,,,,,,,,,,,,,
118,"Headaches, fatigue, &amp; fever are all symptoms of #flu. Learn more about the differences between cold &amp; #flu:…",FALSE,3,NA,2/26/19 18:01,TRUE,NA,1.10E+18,NA,"<a href=\https://www.hootsuite.com\"" rel=\""nofollow\"">Hootsuite Inc.</a>""",NFIDvaccines,4,FALSE,FALSE,NA,NA,,,,,,,,,,,,,,,,,,,,,,,,,,,,,,,,,,
120,"Worried that you could get the flu from a flu shot? The flu vaccine is made with dead flu viruses, so it can’t giv…",FALSE,1,NA,2/26/19 17:01,TRUE,NA,1.10E+18,NA,"<a href=\https://www.socialreport.com\"" rel=\""nofollow\"">SocialReport.com</a>""",stopflunow,1,FALSE,FALSE,NA,NA,,,,,,,,,,,,,,,,,,,,,,,,,,,,,,,,,,
121,Influenza: could be one less thing your child brings home this winter. Protect them and yourself. More info:…,FALSE,0,NA,2/26/19 16:05,TRUE,NA,1.10E+18,NA,"<a href=\https://about.twitter.com/products/tweetdeck\"" rel=\""nofollow\"">TweetDeck</a>""",AHS_NorthZone,0,FALSE,FALSE,NA,NA,,,,,,,,,,,,,,,,,,,,,,,,,,,,,,,,,,
122,Abt’s Sarah Ball is part of a #globalcommunity of researchers invested in #FluResearch. Learn how she’s working t…,FALSE,8,NA,2/26/19 15:30,TRUE,NA,1.10E+18,NA,"<a href=\https://sproutsocial.com\"" rel=\""nofollow\"">Sprout Social</a>""",abtassociates,4,FALSE,FALSE,NA,NA,,,,,,,,,,,,,,,,,,,,,,,,,,,,,,,,,,
123,Nebraska near top of list for reported flu cases as cold weather persists - #FightFlu,FALSE,4,NA,2/26/19 15:21,FALSE,NA,1.10E+18,NA,"<a href=\http://twitter.com\"" rel=\""nofollow\"">Twitter Web Client</a>""",famfightflu,5,FALSE,FALSE,NA,NA,,,,,,,,,,,,,,,,,,,,,,,,,,,,,,,,,,
125,"If you are 1 of the 31+ million US adults with #asthma or #COPD, #flu can cause serious health complications.…",FALSE,2,NA,2/26/19 13:45,TRUE,NA,1.10E+18,NA,"<a href=\https://www.hootsuite.com\"" rel=\""nofollow\"">Hootsuite Inc.</a>""",NFIDvaccines,2,FALSE,FALSE,NA,NA,,,,,,,,,,,,,,,,,,,,,,,,,,,,,,,,,,
126,"#DYK: Each year, seasonal #flu places a significant burden on the health of people in the US? For up-to-date info o…",FALSE,1,NA,2/26/19 12:30,TRUE,NA,1.10E+18,NA,"<a href=\https://www.hootsuite.com\"" rel=\""nofollow\"">Hootsuite Inc.</a>""",NFIDvaccines,0,FALSE,FALSE,NA,NA,,,,,,,,,,,,,,,,,,,,,,,,,,,,,,,,,,
127,"In time for season change, protect your body against cold, other aches and pains with the power of #turmeric. Get y…",FALSE,5,NA,2/26/19 5:00,TRUE,NA,1.10E+18,NA,"<a href=\https://sproutsocial.com\"" rel=\""nofollow\"">Sprout Social</a>""",OrganicIndia,2,FALSE,FALSE,NA,NA,,,,,,,,,,,,,,,,,,,,,,,,,,,,,,,,,,
128,@DrHietanen Am very frustrated by the many people who think they’ve gotten “misdiagnosed.” How can we educate peo…,FALSE,3,DrHietanen,2/25/19 23:53,TRUE,1.10E+18,1.10E+18,831590066,"<a href=\http://twitter.com/download/iphone\"" rel=\""nofollow\"">Twitter for iPhone</a>""",DrCJohns,0,FALSE,FALSE,NA,NA,,,,,,,,,,,,,,,,,,,,,,,,,,,,,,,,,,
129,Flu season isn't over yet. Don't forget these tips to #fightflu,FALSE,0,NA,2/25/19 23:31,FALSE,NA,1.10E+18,NA,"<a href=\http://twitter.com\"" rel=\""nofollow\"">Twitter Web Client</a>""",DignityHealthCC,0,FALSE,FALSE,NA,NA,,,,,,,,,,,,,,,,,,,,,,,,,,,,,,,,,,
130,WHO issues recommendations on next season's #flu vaccine composition The #vaccines for the 2019-20 season in the No…,FALSE,5,NA,2/25/19 23:25,TRUE,NA,1.10E+18,NA,"<a href=\https://sproutsocial.com\"" rel=\""nofollow\"">Sprout Social</a>""",famfightflu,5,FALSE,FALSE,NA,NA,,,,,,,,,,,,,,,,,,,,,,,,,,,,,,,,,,
131,High-dose #flu #vaccine more effective than standard vaccines in older adults via @GoHealio…,FALSE,1,NA,2/25/19 22:15,TRUE,NA,1.10E+18,NA,"<a href=\https://www.hootsuite.com\"" rel=\""nofollow\"">Hootsuite Inc.</a>""",NFIDvaccines,1,FALSE,FALSE,NA,NA,,,,,,,,,,,,,,,,,,,,,,,,,,,,,,,,,,
132,"Getting kids vaccinated is crucial. This season, flu has already claimed the lives of 41 children #VaccinesWork #fightflu",FALSE,0,NA,2/25/19 22:02,FALSE,NA,1.10E+18,NA,"<a href=\http://twitter.com\"" rel=\""nofollow\"">Twitter Web Client</a>""",beisos,0,FALSE,FALSE,NA,NA,,,,,,,,,,,,,,,,,,,,,,,,,,,,,,,,,,
133,"Recent @CDCgov report: 7 more children have died from the #flu, bringing the total to 41. Help #FightFlu &amp; learn mo…",FALSE,0,NA,2/25/19 21:19,TRUE,NA,1.10E+18,NA,"<a href=\http://twitter.com\"" rel=\""nofollow\"">Twitter Web Client</a>""",PediatricTrials,0,FALSE,FALSE,NA,NA,,,,,,,,,,,,,,,,,,,,,,,,,,,,,,,,,,
134,#FightFlu by getting you and your family the flu shot - there's still a lot of the flu season to come. @USNewsHealth,FALSE,0,NA,2/25/19 20:55,FALSE,NA,1.10E+18,NA,"<a href=\http://twitter.com\"" rel=\""nofollow\"">Twitter Web Client</a>""",KnowYourDose,0,FALSE,FALSE,NA,NA,,,,,,,,,,,,,,,,,,,,,,,,,,,,,,,,,,
135,"Symptoms of the #flu can include fever, cough, sore throat, runny/stuffy nose, body aches, headaches, chills and fa…",FALSE,3,NA,2/25/19 20:45,TRUE,NA,1.10E+18,NA,"<a href=\https://about.twitter.com/products/tweetdeck\"" rel=\""nofollow\"">TweetDeck</a>""",FLHealthDuval,3,FALSE,FALSE,NA,NA,,,,,,,,,,,,,,,,,,,,,,,,,,,,,,,,,,
136,#FightFlu I got Flu shot in December and Now I have the Flu Fever Coughing etc. But now they say let it takes its c…,FALSE,0,NA,2/25/19 20:12,TRUE,NA,1.10E+18,NA,"<a href=\http://twitter.com/download/android\"" rel=\""nofollow\"">Twitter for Android</a>""",HargiHero,0,FALSE,FALSE,NA,NA,,,,,,,,,,,,,,,,,,,,,,,,,,,,,,,,,,
