no,text,favorited,favoriteCount,replyToSN,created,truncated,replyToSID,id,replyToUID,statusSource,screenName,retweetCount,isRetweet,retweeted,longitude,latitude,,
22,"Whilst most of us don't like to admit defeat when we're ill, the most considerate thing we can do to avoid sharing…",FALSE,0,NA,3/7/19 7:56,TRUE,NA,1.10356E+18,NA,"<a href=\https://buffer.com\"" rel=\""nofollow\"">Buffer</a>""",WooshWashrooms,0,FALSE,FALSE,NA,NA,,
23,Hope you like pedialyte. #parenting #fluseason,FALSE,0,NA,3/7/19 4:55,FALSE,NA,1.10352E+18,NA,"<a href=\http://twitter.com/download/iphone\"" rel=\""nofollow\"">Twitter for iPhone</a>""",BrookeManolis,0,FALSE,FALSE,NA,NA,,
24,Dr. James Lin shares 5 tips for staying healthy when others are sick. ➔ #fluseason,FALSE,5,NA,3/7/19 3:00,FALSE,NA,1.10349E+18,NA,"<a href=\https://www.sprinklr.com\"" rel=\""nofollow\"">Sprinklr</a>""",sharphealthcare,0,FALSE,FALSE,NA,NA,,
25,i am feeling much better so my darling and our youngest are now sick. #familyties #fluseason #hadtheshot SO to my…,FALSE,1,NA,3/7/19 2:13,TRUE,NA,1.10348E+18,NA,"<a href=\http://twitter.com/download/android\"" rel=\""nofollow\"">Twitter for Android</a>""",itsanancything,0,FALSE,FALSE,NA,NA,,
26,Do you have enough #VitaminC? 🍊 #cold #cough #fluseason #allergyseason #boost #immunesystem #immune #boostpower #flu,FALSE,1,NA,3/7/19 1:26,FALSE,NA,1.10347E+18,NA,"<a href=\http://twitter.com/download/iphone\"" rel=\""nofollow\"">Twitter for iPhone</a>""",GetBoostPower,0,FALSE,FALSE,NA,NA,,
27,Worried about germs at work? Ask your office manager or HR department to install a waterless hand-washing station.…,FALSE,0,NA,3/7/19 0:58,TRUE,NA,1.10346E+18,NA,"<a href=\http://www.facebook.com/twitter\"" rel=\""nofollow\"">Facebook</a>""",CCAquaticCenter,0,FALSE,FALSE,NA,NA,,
28,This flu is completely savage and as the caregiver for someone fighting cancer I can not be too careful. I don’t re…,FALSE,0,NA,3/7/19 0:14,TRUE,NA,1.10345E+18,NA,"<a href=\http://twitter.com/download/iphone\"" rel=\""nofollow\"">Twitter for iPhone</a>""",britishemily78,0,FALSE,FALSE,NA,NA,,
29,#Fluseason is upon us and germs are coming at us from all directions. It's well worth arming yourself against aches…,FALSE,0,NA,3/7/19 0:00,TRUE,NA,1.10345E+18,NA,"<a href=\http://hearsaysystems.com\"" rel=\""nofollow\"">Hearsay Social</a>""",ElvisGarciaIns,0,FALSE,FALSE,NA,NA,,