no,text,favorited,favoriteCount,replyToSN,created,truncated,replyToSID,id,replyToUID,statusSource,screenName,retweetCount,isRetweet,retweeted,longitude,latitude,,,,,,,,,,,,,,,,,
1,Don't forget to change your #toothbrush after you're sick! #stayhealthy #fluseason,FALSE,0,NA,3/6/19 2:51,FALSE,NA,1.10E+18,NA,"<a href=\https://www.socialreport.com\"" rel=\""nofollow\"">SocialReport.com</a>""",FraserVDentist,0,FALSE,FALSE,NA,NA,,,,,,,,,,,,,,,,,
3,A love note to my fellow educators... #fluseason,FALSE,0,NA,3/6/19 2:38,FALSE,NA,1.10E+18,NA,"<a href=\http://twitter.com/download/iphone\"" rel=\""nofollow\"">Twitter for iPhone</a>""",JordansJargon,0,FALSE,FALSE,NA,NA,,,,,,,,,,,,,,,,,
4,Getting chapped lips suck. But having a runny ass nose and then getting some chapped nostrils is worse. #fluseason,FALSE,0,NA,3/6/19 2:33,FALSE,NA,1.10E+18,NA,"<a href=\http://twitter.com/download/android\"" rel=\""nofollow\"">Twitter for Android</a>""",Monicaminty,0,FALSE,FALSE,NA,NA,,,,,,,,,,,,,,,,,
5,Hand sanitizer greeting for morning meeting! #responsiveclassroom #WeAreDPS #fluseason #FalconsSoar,FALSE,5,NA,3/6/19 1:48,FALSE,NA,1.10E+18,NA,"<a href=\http://twitter.com/download/iphone\"" rel=\""nofollow\"">Twitter for iPhone</a>""",MsNash1st,0,FALSE,FALSE,NA,NA,,,,,,,,,,,,,,,,,
6,"Just charcoal-clay-masked, bubble-bathed my way through this damn cold. Charcoal removes toxins right? Totally coun…",FALSE,0,NA,3/6/19 1:36,TRUE,NA,1.10E+18,NA,"<a href=\http://twitter.com/download/iphone\"" rel=\""nofollow\"">Twitter for iPhone</a>""",cdubbs420,0,FALSE,FALSE,NA,NA,,,,,,,,,,,,,,,,,
7,"Being sick SUCKS 😷🤧🤒 but at least I have a cute boyfriend who is playing doctor, nurse, masseuse and all around bes…",FALSE,0,NA,3/6/19 1:09,TRUE,NA,1.10E+18,NA,"<a href=\http://twitter.com/download/android\"" rel=\""nofollow\"">Twitter for Android</a>""",MirandaLBusby,0,FALSE,FALSE,NA,NA,,,,,,,,,,,,,,,,,
8,"Apparently, wearing onions on the backs of your feet helps cure colds. After 10 days of suffering, I’ll try almost…",FALSE,3,NA,3/6/19 0:25,TRUE,NA,1.10E+18,NA,"<a href=\http://twitter.com/download/iphone\"" rel=\""nofollow\"">Twitter for iPhone</a>""",MeredithSchorr,0,FALSE,FALSE,NA,NA,,,,,,,,,,,,,,,,,
9,Not the one when you finally finish work for 2 weeks annual leave and you’ve got a chest infection 😭😭😭😭 #FluSeason,FALSE,0,NA,3/5/19 23:42,FALSE,NA,1.10E+18,NA,"<a href=\http://twitter.com/download/iphone\"" rel=\""nofollow\"">Twitter for iPhone</a>""",SugaTaeKookie95,0,FALSE,FALSE,NA,NA,,,,,,,,,,,,,,,,,
10,I mean it is #Fluseason 🤫🤧,FALSE,0,NA,3/5/19 23:36,FALSE,NA,1.10E+18,NA,"<a href=\http://twitter.com/download/iphone\"" rel=\""nofollow\"">Twitter for iPhone</a>""",EmpressJordann,0,FALSE,FALSE,NA,NA,,,,,,,,,,,,,,,,,
11,#Fluseason is here. Germs are everywhere. Even in your car. Disinfecting wipes help clean bacteria-prone surfaces l…,FALSE,1,NA,3/5/19 23:00,TRUE,NA,1.10E+18,NA,"<a href=\http://hearsaysystems.com\"" rel=\""nofollow\"">Hearsay Social</a>""",jeanettespinel1,0,FALSE,FALSE,NA,NA,,,,,,,,,,,,,,,,,
12,"Oh. On said story, I've written 280 words....#fluseason",FALSE,1,NA,3/5/19 22:51,FALSE,NA,1.10E+18,NA,"<a href=\http://twitter.com\"" rel=\""nofollow\"">Twitter Web Client</a>""",AbigailBassett,0,FALSE,FALSE,NA,NA,,,,,,,,,,,,,,,,,
13,#Fluseason is upon us and germs are coming at us from all directions. It's well worth arming yourself against aches…,FALSE,0,NA,3/5/19 22:30,TRUE,NA,1.10E+18,NA,"<a href=\http://hearsaysystems.com\"" rel=\""nofollow\"">Hearsay Social</a>""",Lyle_insurance,0,FALSE,FALSE,NA,NA,,,,,,,,,,,,,,,,,
14,"✨ To keep your #house_clean and #disinfected always,♻️ You have to be careful where more bacteria are there so as…",FALSE,0,NA,3/5/19 22:27,TRUE,NA,1.10E+18,NA,"<a href=\http://twitter.com/download/android\"" rel=\""nofollow\"">Twitter for Android</a>""",cindysjanitoria,0,FALSE,FALSE,NA,NA,,,,,,,,,,,,,,,,,
15,When you sneeze so hard that your shoulder hurts... 🤧🤒 #fluseason,FALSE,0,NA,3/5/19 22:27,FALSE,NA,1.10E+18,NA,"<a href=\http://twitter.com/download/iphone\"" rel=\""nofollow\"">Twitter for iPhone</a>""",benmcgue730,0,FALSE,FALSE,NA,NA,,,,,,,,,,,,,,,,,
16,It's my favourite season 🙄#fluseason #saidnooneever,FALSE,0,NA,3/5/19 22:09,FALSE,NA,1.10E+18,NA,"<a href=\http://twitter.com/download/android\"" rel=\""nofollow\"">Twitter for Android</a>""",BrittanySalisb6,0,FALSE,FALSE,NA,NA,,,,,,,,,,,,,,,,,
17,"Good news for now... the number of reported flu cases in Montana are decreasing. But, state health officials are ex…",FALSE,0,NA,3/5/19 21:51,TRUE,NA,1.10E+18,NA,"<a href=\http://twitter.com\"" rel=\""nofollow\"">Twitter Web Client</a>""",KaitlinM_abcfox,0,FALSE,FALSE,NA,NA,,,,,,,,,,,,,,,,,
18,"Joeseph B. Friedman invented the ‘bendy’ straw in the 1930’s, making drinking easier for sick people all over the world. #fluseason",FALSE,0,NA,3/5/19 21:16,FALSE,NA,1.10E+18,NA,"<a href=\http://twitter.com/download/iphone\"" rel=\""nofollow\"">Twitter for iPhone</a>""",sandyoianthomas,0,FALSE,FALSE,NA,NA,,,,,,,,,,,,,,,,,
19,Genuinely don’t remember the last time I got a good night’s sleep. Def been over a week. #fluseason,FALSE,0,NA,3/5/19 21:09,FALSE,NA,1.10E+18,NA,"<a href=\http://twitter.com/download/iphone\"" rel=\""nofollow\"">Twitter for iPhone</a>""",chugh4,0,FALSE,FALSE,NA,NA,,,,,,,,,,,,,,,,,
20,Did the cold and flu make its way into your house this year? @todaysparent shares 5 nutritious &amp; delicious foods th…,FALSE,0,NA,3/5/19 19:30,TRUE,NA,1.10E+18,NA,"<a href=\http://www.falcon.io\"" rel=\""nofollow\"">Falcon Social Media Management </a>""",ideaMuseumMesa,0,FALSE,FALSE,NA,NA,,,,,,,,,,,,,,,,,
21,"With 15% of their staff out and 25% of students in 2 out of 5 schools absent, Wagoner Public Schools officials are…",FALSE,0,NA,3/5/19 19:30,TRUE,NA,1.10E+18,NA,"<a href=\https://www.sprinklr.com\"" rel=\""nofollow\"">Sprinklr</a>""",CloroxPro,1,FALSE,FALSE,NA,NA,,,,,,,,,,,,,,,,,
22,"#Sickwhilepregnant? Here are 16 things you can do to help you feel better faster, from the…",FALSE,0,NA,3/5/19 19:11,TRUE,NA,1.10E+18,NA,"<a href=\http://www.hubspot.com/\"" rel=\""nofollow\"">HubSpot</a>""",whpediatrics,0,FALSE,FALSE,NA,NA,,,,,,,,,,,,,,,,,
23,Tips for helping patients manage the #Flu... And here's how US Med-Equip is helping healthcare providers and hospi…,FALSE,0,NA,3/5/19 18:57,TRUE,NA,1.10E+18,NA,"<a href=\https://about.twitter.com/products/tweetdeck\"" rel=\""nofollow\"">TweetDeck</a>""",usmedequip,0,FALSE,FALSE,NA,NA,,,,,,,,,,,,,,,,,
24,The 2018-2019 #fluseason may have peaked as the major nationwide measure of #influenza activity held steady for the…,FALSE,0,NA,3/5/19 18:34,TRUE,NA,1.10E+18,NA,"<a href=\http://twitter.com\"" rel=\""nofollow\"">Twitter Web Client</a>""",ClinRev,0,FALSE,FALSE,NA,NA,,,,,,,,,,,,,,,,,
25,"The #CDC Flu map for week 8 - ending February 23 - shows only Hawaii and Washington, D.C. without widespread influe…",FALSE,0,NA,3/5/19 18:00,TRUE,NA,1.10E+18,NA,"<a href=\https://www.hootsuite.com\"" rel=\""nofollow\"">Hootsuite Inc.</a>""",MMCAP_Online,0,FALSE,FALSE,NA,NA,,,,,,,,,,,,,,,,,
26,Each year #FluSeason comes with a new vaccine to protect against a different strain of the flu virus. #UMaine resea…,FALSE,7,NA,3/5/19 17:30,TRUE,NA,1.10E+18,NA,"<a href=\http://twitter.com\"" rel=\""nofollow\"">Twitter Web Client</a>""",UMaine,4,FALSE,FALSE,NA,NA,,,,,,,,,,,,,,,,,
27,Everyone at work (including me) is sniffling and coughing. It’s like we are all back in pre school lol. #fluseason,FALSE,1,NA,3/5/19 17:17,FALSE,NA,1.10E+18,NA,"<a href=\http://twitter.com/download/iphone\"" rel=\""nofollow\"">Twitter for iPhone</a>""",GiselleArica,0,FALSE,FALSE,NA,NA,,,,,,,,,,,,,,,,,
28,Don’t let the #flu keep you from celebrating Mardi Gras – there’s still time to get your flu shot! #flushot…,FALSE,0,NA,3/5/19 17:00,TRUE,NA,1.10E+18,NA,"<a href=\https://sproutsocial.com\"" rel=\""nofollow\"">Sprout Social</a>""",QualityInsights,0,FALSE,FALSE,NA,NA,,,,,,,,,,,,,,,,,
29,Pineapple and pineapple juice is way more effective than cough syrup and also helps prevent the flu and colds…,FALSE,2,NA,3/5/19 16:57,TRUE,NA,1.10E+18,NA,"<a href=\http://twitter.com/download/iphone\"" rel=\""nofollow\"">Twitter for iPhone</a>""",LuvPotion_No9,1,FALSE,FALSE,NA,NA,,,,,,,,,,,,,,,,,
30,Thanks for the holistic remedies but I just got some Oseltamivir Phosphate Capsules. Ill see you in a few days. #Fluseason #Thestarreport,FALSE,43,NA,3/5/19 16:22,FALSE,NA,1.10E+18,NA,"<a href=\http://twitter.com\"" rel=\""nofollow\"">Twitter Web Client</a>""",troitorain,9,FALSE,FALSE,NA,NA,,,,,,,,,,,,,,,,,
31,@YaleEIP FluSurv-NET surveillance expertise is on the pulse of CT flu hospitalizations. Week 8 update for the 2018-…,FALSE,3,YaleEIP,3/5/19 16:18,TRUE,NA,1.10E+18,1.02E+18,"<a href=\http://twitter.com\"" rel=\""nofollow\"">Twitter Web Client</a>""",YaleEIP,0,FALSE,FALSE,NA,NA,,,,,,,,,,,,,,,,,
32,"Its flu season, drink plenty of the right fluids and don’t forget to change your toothbrush!…",FALSE,2,NA,3/5/19 16:00,TRUE,NA,1.10E+18,NA,"<a href=\https://sproutsocial.com\"" rel=\""nofollow\"">Sprout Social</a>""",RonDinningDMD,0,FALSE,FALSE,NA,NA,,,,,,,,,,,,,,,,,
33,"Flu? Cold? No matter what you're sick with, nothing is as bad as not having sub plans prepared. Luckily, we've got…",FALSE,0,NA,3/5/19 15:54,TRUE,NA,1.10E+18,NA,"<a href=\https://buffer.com\"" rel=\""nofollow\"">Buffer</a>""",learnwithalbert,0,FALSE,FALSE,NA,NA,,,,,,,,,,,,,,,,,
34,"Sick in bed today, my tummy hurts so much it just reminds me of all the times I missed school from getting sick 😷 🤒…",FALSE,0,NA,3/5/19 15:19,TRUE,NA,1.10E+18,NA,"<a href=\http://twitter.com/download/iphone\"" rel=\""nofollow\"">Twitter for iPhone</a>""",suiskitz,0,FALSE,FALSE,NA,NA,,,,,,,,,,,,,,,,,
35,The office is one of the easiest places to catch the flu - Cleaning Will Help Workers Stay Healthy…,FALSE,0,NA,3/5/19 15:07,TRUE,NA,1.10E+18,NA,"<a href=\http://twitter.com\"" rel=\""nofollow\"">Twitter Web Client</a>""",cleaning_Mag,0,FALSE,FALSE,NA,NA,,,,,,,,,,,,,,,,,
36,Do you get sick more often during the winter months? #fluseason #winterblues,FALSE,1,NA,3/5/19 14:43,FALSE,NA,1.10E+18,NA,"<a href=\http://twitter.com/download/iphone\"" rel=\""nofollow\"">Twitter for iPhone</a>""",karlaschaus,0,FALSE,FALSE,NA,NA,,,,,,,,,,,,,,,,,
37,When your day starts with a run to @shopprsdrugmart ... you know it is going to be rough. #flusucks #fluseason,FALSE,1,NA,3/5/19 13:42,FALSE,NA,1.10E+18,NA,"<a href=\http://twitter.com/download/android\"" rel=\""nofollow\"">Twitter for Android</a>""",carleekat,0,FALSE,FALSE,NA,NA,,,,,,,,,,,,,,,,,
38,"@David_Suchet, may your little grey cells solve the case that is my horrendous flu. #poirot #agathachristie…",FALSE,0,David_Suchet,3/5/19 13:38,TRUE,NA,1.10E+18,400086050,"<a href=\http://twitter.com/download/android\"" rel=\""nofollow\"">Twitter for Android</a>""",JWP_____,0,FALSE,FALSE,NA,NA,,,,,,,,,,,,,,,,,
39,The Flu: What To Do If You Get Sick via @CDCgov #flu #fluseason,FALSE,0,NA,3/5/19 13:05,FALSE,NA,1.10E+18,NA,"<a href=\https://www.hootsuite.com\"" rel=\""nofollow\"">Hootsuite Inc.</a>""",GattiRx,0,FALSE,FALSE,NA,NA,,,,,,,,,,,,,,,,,
40,If you are suffering from cold and flu then here are few best cold and flu medicines you need to check out. To kn…,FALSE,0,NA,3/5/19 11:15,TRUE,NA,1.10E+18,NA,"<a href=\http://twitter.com\"" rel=\""nofollow\"">Twitter Web Client</a>""",Health_Clubfind,0,FALSE,FALSE,NA,NA,,,,,,,,,,,,,,,,,
41,"Attending a meeting for approx 20 people: 1000 wipes, 800 tissues and 2.4 litres of hand gel. #fluseason No excuse…",FALSE,3,NA,3/5/19 9:29,TRUE,NA,1.10E+18,NA,"<a href=\http://twitter.com/download/iphone\"" rel=\""nofollow\"">Twitter for iPhone</a>""",Malcolm_999,0,FALSE,FALSE,NA,NA,,,,,,,,,,,,,,,,,
42,Extroverts should not have to get sick. Because being quarantined in your own house is the actual worst #fluseason,FALSE,2,NA,3/5/19 8:50,FALSE,NA,1.10E+18,NA,"<a href=\http://twitter.com/download/iphone\"" rel=\""nofollow\"">Twitter for iPhone</a>""",blannio,0,FALSE,FALSE,NA,NA,,,,,,,,,,,,,,,,,
43,I wear my mask on my chin because my chin is broke out. My chin is broke out because I wear my mask on my chin. It’…,FALSE,1,NA,3/5/19 8:07,TRUE,NA,1.10E+18,NA,"<a href=\http://twitter.com/download/iphone\"" rel=\""nofollow\"">Twitter for iPhone</a>""",_britjanes,0,FALSE,FALSE,NA,NA,,,,,,,,,,,,,,,,,
44,Has anyone created rent-a-bae yet? Snuggle me and feed me soup and cough drops. #fluseason #sickness,FALSE,0,NA,3/5/19 5:29,FALSE,NA,1.10E+18,NA,"<a href=\http://twitter.com/download/iphone\"" rel=\""nofollow\"">Twitter for iPhone</a>""",vquinness,0,FALSE,FALSE,NA,NA,,,,,,,,,,,,,,,,,
45,I just ordered soup from @Postmates and the guy came from super far away and then I asked for two blueberry muffins…,FALSE,0,NA,3/5/19 2:53,TRUE,NA,1.10E+18,NA,"<a href=\http://twitter.com/download/iphone\"" rel=\""nofollow\"">Twitter for iPhone</a>""",SanDiegoBunny,0,FALSE,FALSE,NA,NA,,,,,,,,,,,,,,,,,
46,I’ve been surrounded by so many sick people I should start using one of these at work: #fluseason #stayaway,FALSE,2,NA,3/5/19 2:48,FALSE,NA,1.10E+18,NA,"<a href=\http://twitter.com/download/iphone\"" rel=\""nofollow\"">Twitter for iPhone</a>""",PhotogKatherine,0,FALSE,FALSE,NA,NA,,,,,,,,,,,,,,,,,
47,@David_Suchet may your little grey cells solve the case that is my horrendous flu. #poirot #agathachristie…,FALSE,0,David_Suchet,3/5/19 2:37,TRUE,NA,1.10E+18,400086050,"<a href=\http://twitter.com/download/android\"" rel=\""nofollow\"">Twitter for Android</a>""",JWP_____,0,FALSE,FALSE,NA,NA,,,,,,,,,,,,,,,,,
48,So many sick people on the plane. There is one hacking right behind me. All my anti-bacteria arsenals are out.…,FALSE,0,NA,3/5/19 2:16,TRUE,NA,1.10E+18,NA,"<a href=\http://twitter.com/download/iphone\"" rel=\""nofollow\"">Twitter for iPhone</a>""",teri604,0,FALSE,FALSE,NA,NA,,,,,,,,,,,,,,,,,
49,My most heartfelt wishes for a speedy recovery to all of the people being hit with the ‘crud.’ Our office looks lik…,FALSE,2,NA,3/5/19 1:52,TRUE,NA,1.10E+18,NA,"<a href=\http://twitter.com/download/iphone\"" rel=\""nofollow\"">Twitter for iPhone</a>""",AnissaCenters,0,FALSE,FALSE,NA,NA,,,,,,,,,,,,,,,,,
50,Totally took from a FB xPost. Unknown OP. #HealthCareProblems #FluSeason #FunnyIsFunny,FALSE,0,NA,3/5/19 1:11,FALSE,NA,1.10E+18,NA,"<a href=\http://twitter.com/download/iphone\"" rel=\""nofollow\"">Twitter for iPhone</a>""",DrCyberNinja,0,FALSE,FALSE,NA,NA,,,,,,,,,,,,,,,,,
51,It’s the whole “enough energy” thing that’s getting me this time around. 😞😷 #fluseason #overit,FALSE,0,NA,3/5/19 0:52,FALSE,NA,1.10E+18,NA,"<a href=\http://twitter.com/download/iphone\"" rel=\""nofollow\"">Twitter for iPhone</a>""",kray4cy,0,FALSE,FALSE,NA,NA,,,,,,,,,,,,,,,,,
52,Here’s you a little chuckle just in case you’re looking for that good clean end-of-the-day-pick-me-up! Lol #chuckle…,FALSE,3,NA,3/5/19 0:25,TRUE,NA,1.10E+18,NA,"<a href=\http://twitter.com/download/iphone\"" rel=\""nofollow\"">Twitter for iPhone</a>""",Angie_lefty22,0,FALSE,FALSE,NA,NA,,,,,,,,,,,,,,,,,
54,Tips For Relieving Sinus Infection ♥♥♥ Read Further ☞ #Dental #Clinic…,FALSE,1,NA,3/4/19 23:15,TRUE,NA,1.10E+18,NA,"<a href=\https://www.hootsuite.com\"" rel=\""nofollow\"">Hootsuite Inc.</a>""",nvfamilydental,1,FALSE,FALSE,NA,NA,,,,,,,,,,,,,,,,,
55,This is when I high key got zero baby fever because all the poor babies getting sick. #fluseason,FALSE,2,NA,3/4/19 22:54,FALSE,NA,1.10E+18,NA,"<a href=\http://twitter.com/download/iphone\"" rel=\""nofollow\"">Twitter for iPhone</a>""",beertearss,0,FALSE,FALSE,NA,NA,,,,,,,,,,,,,,,,,
56,Me going to work trying not to catch the flu #fluseason #schools,FALSE,0,NA,3/4/19 21:51,FALSE,NA,1.10E+18,NA,"<a href=\http://twitter.com/download/android\"" rel=\""nofollow\"">Twitter for Android</a>""",The_Octopuslife,0,FALSE,FALSE,NA,NA,,,,,,,,,,,,,,,,,
57,"How can you tell if you have a cold or the flu? Check out this infographic to see which symptoms you have, and if y…",FALSE,0,NA,3/4/19 21:23,TRUE,NA,1.10E+18,NA,"<a href=\https://buffer.com\"" rel=\""nofollow\"">Buffer</a>""",FQHealth,0,FALSE,FALSE,NA,NA,,,,,,,,,,,,,,,,,
58,"When you're feeling #sick, when should you make an appointment with your doctor? #fluseason…",FALSE,0,NA,3/4/19 21:20,TRUE,NA,1.10E+18,NA,"<a href=\https://about.twitter.com/products/tweetdeck\"" rel=\""nofollow\"">TweetDeck</a>""",NewportHospital,0,FALSE,FALSE,NA,NA,,,,,,,,,,,,,,,,,
59,Sorry for the inconvenience. Caught someone cold/ flu ugh and I got it bad. #cold #fluseason #offwork #bedrest…,FALSE,0,NA,3/4/19 19:18,TRUE,NA,1.10E+18,NA,"<a href=\http://instagram.com\"" rel=\""nofollow\"">Instagram</a>""",SilverLinerSpa,0,FALSE,FALSE,NA,NA,,,,,,,,,,,,,,,,,
60,#MondayMotivation with MrSteam. Natural Ways to Combat the Cold and Flu Season #fluseason…,FALSE,0,NA,3/4/19 19:08,TRUE,NA,1.10E+18,NA,"<a href=\http://www.hubspot.com/\"" rel=\""nofollow\"">HubSpot</a>""",steamtherapy,0,FALSE,FALSE,NA,NA,,,,,,,,,,,,,,,,,
61,We're about to be trapped in between flu and allergy season! Be prepared for your family's sake! #fluseason…,FALSE,0,NA,3/4/19 19:00,TRUE,NA,1.10E+18,NA,"<a href=\https://www.hootsuite.com\"" rel=\""nofollow\"">Hootsuite Inc.</a>""",vitamininfuse,0,FALSE,FALSE,NA,NA,,,,,,,,,,,,,,,,,
62,Follow @CDCFlu for #fluseason updates and tips to protect yourself and your family from #flu.…,FALSE,42,NA,3/4/19 18:27,TRUE,NA,1.10E+18,NA,"<a href=\https://sproutsocial.com\"" rel=\""nofollow\"">Sprout Social</a>""",CDCgov,29,FALSE,FALSE,NA,NA,,,,,,,,,,,,,,,,,
63,"#DidYouKnow that there's new technology available to help diagnose the flu faster? Find out more about it, plus mor…",FALSE,1,NA,3/4/19 18:21,TRUE,NA,1.10E+18,NA,"<a href=\https://coschedule.com\"" rel=\""nofollow\"">CoSchedule</a>""",faithhealthhome,0,FALSE,FALSE,NA,NA,,,,,,,,,,,,,,,,,
64,"FMA preferred vendor @FloridaRXCard could save your patients up to 75% on prescription medications at 68,000-plus r…",FALSE,2,NA,3/4/19 18:02,TRUE,NA,1.10E+18,NA,"<a href=\http://twitter.com\"" rel=\""nofollow\"">Twitter Web Client</a>""",FloridaMedical,2,FALSE,FALSE,NA,NA,,,,,,,,,,,,,,,,,
65,The latest CDC flu forecast predicts that the #flu is peaking and will continue this month. Here's what patients ca…,FALSE,0,NA,3/4/19 17:45,TRUE,NA,1.10E+18,NA,"<a href=\https://www.hootsuite.com\"" rel=\""nofollow\"">Hootsuite Inc.</a>""",TVoxSolutions,0,FALSE,FALSE,NA,NA,,,,,,,,,,,,,,,,,
66,How many teachers and school staff need this contraption #fluseason,FALSE,4,NA,3/4/19 17:37,FALSE,NA,1.10E+18,NA,"<a href=\http://twitter.com/download/iphone\"" rel=\""nofollow\"">Twitter for iPhone</a>""",TcamSky,0,FALSE,FALSE,NA,NA,,,,,,,,,,,,,,,,,
67,Spot flu symptoms in kids and know your treatment options. #flushot #fluseason #flu,FALSE,0,NA,3/4/19 17:09,FALSE,NA,1.10E+18,NA,"<a href=\https://sproutsocial.com\"" rel=\""nofollow\"">Sprout Social</a>""",ParkNicollet,0,FALSE,FALSE,NA,NA,,,,,,,,,,,,,,,,,
68,"Now that September is here, flu season is right around the corner. If you happen to come down with a bug this winte…",FALSE,0,NA,3/4/19 17:01,TRUE,NA,1.10E+18,NA,"<a href=\https://www.hootsuite.com\"" rel=\""nofollow\"">Hootsuite Inc.</a>""",bolling_md,0,FALSE,FALSE,NA,NA,,,,,,,,,,,,,,,,,
69,"While flu season is beginning to wind down, you're still susceptible to contracting it. You can also usually tell i…",FALSE,0,NA,3/4/19 17:01,TRUE,NA,1.10E+18,NA,"<a href=\https://www.hootsuite.com\"" rel=\""nofollow\"">Hootsuite Inc.</a>""",georgesjabalymd,0,FALSE,FALSE,NA,NA,,,,,,,,,,,,,,,,,
70,#MondayMotivation: Beat the #Flu in the office this #FluSeason with these expert tips:,FALSE,0,NA,3/4/19 17:00,FALSE,NA,1.10E+18,NA,"<a href=\https://www.hootsuite.com\"" rel=\""nofollow\"">Hootsuite Inc.</a>""",RockfordMutual,1,FALSE,FALSE,NA,NA,,,,,,,,,,,,,,,,,
71,"Some flu vaccines are made with a bit of egg protein, so those with an egg allergy shouldn't seek out this vaccine.…",FALSE,0,NA,3/4/19 16:58,TRUE,NA,1.10E+18,NA,"<a href=\https://www.socialreport.com\"" rel=\""nofollow\"">SocialReport.com</a>""",StMichaelsER,0,FALSE,FALSE,NA,NA,,,,,,,,,,,,,,,,,
72,.@BGOV @business The Flu Is Spreading Across America a Little Later This Season @FayCortez…,FALSE,0,NA,3/4/19 15:54,TRUE,NA,1.10E+18,NA,"<a href=\https://about.twitter.com/products/tweetdeck\"" rel=\""nofollow\"">TweetDeck</a>""",phsu54,1,FALSE,FALSE,NA,NA,,,,,,,,,,,,,,,,,
73,When you’re at the dr office for routine labs and you’re asked to wear a mask. Room full of people with masks!…,FALSE,2,NA,3/4/19 15:35,TRUE,NA,1.10E+18,NA,"<a href=\http://twitter.com/download/iphone\"" rel=\""nofollow\"">Twitter for iPhone</a>""",CampobelloCathy,0,FALSE,FALSE,NA,NA,,,,,,,,,,,,,,,,,
74,"Add strep to the flu, because this girl has both #wintersucks #fluseason",FALSE,0,NA,3/4/19 15:35,FALSE,NA,1.10E+18,NA,"<a href=\http://twitter.com/download/iphone\"" rel=\""nofollow\"">Twitter for iPhone</a>""",danifit_nh,0,FALSE,FALSE,NA,NA,,,,,,,,,,,,,,,,,
75,"Both my little man and I are down #sosick taking turns praying to the porcelain \god\"" not sure what we did to deser…""",FALSE,0,NA,3/4/19 15:26,TRUE,NA,1.10E+18,NA,"<a href=\http://twitter.com/download/android\"" rel=\""nofollow\"">Twitter for Android</a>""",badassinahat,0,FALSE,FALSE,NA,NA,,,,,,,,,,,,,,,,,
77,The #fluseason shows signs of peaking. Get the details:,FALSE,0,NA,3/4/19 14:00,FALSE,NA,1.10E+18,NA,"<a href=\https://about.twitter.com/products/tweetdeck\"" rel=\""nofollow\"">TweetDeck</a>""",MDedgeIntMed,0,FALSE,FALSE,NA,NA,,,,,,,,,,,,,,,,,
79,I’m taking so much Viramin C right now that I’m gonna turn into an orange! 🤦🏼‍♀️🍊 #fluseason #idontwannagetsick,FALSE,0,NA,3/4/19 13:58,FALSE,NA,1.10E+18,NA,"<a href=\http://twitter.com/download/iphone\"" rel=\""nofollow\"">Twitter for iPhone</a>""",tayy_gurl,0,FALSE,FALSE,NA,NA,,,,,,,,,,,,,,,,,
80,Pretty sure I did more coughing than sleeping last night...back to the doctor I go 🙄😷 #secondhome #fluseason,FALSE,1,NA,3/4/19 13:09,FALSE,NA,1.10E+18,NA,"<a href=\http://twitter.com/download/iphone\"" rel=\""nofollow\"">Twitter for iPhone</a>""",MisstoMrstoMS,0,FALSE,FALSE,NA,NA,,,,,,,,,,,,,,,,,
81,Flu season is in FULL EFFECT! The flu vaccine is safe for anyone over the age of 6 months and does not cause the fl…,FALSE,0,NA,3/4/19 3:59,TRUE,NA,1.10E+18,NA,"<a href=\http://twitter.com/download/iphone\"" rel=\""nofollow\"">Twitter for iPhone</a>""",CityOfNOLA,1,FALSE,FALSE,NA,NA,,,,,,,,,,,,,,,,,
82,"📣 Gizmo of the Week! 📣 It's flu season 🤧 so after you wash your hands, fire up your computer, and learn more about…",FALSE,0,NA,3/4/19 3:30,TRUE,NA,1.10E+18,NA,"<a href=\https://www.oktopost.com\"" rel=\""nofollow\"">Oktopost</a>""",ExploreLearning,0,FALSE,FALSE,NA,NA,,,,,,,,,,,,,,,,,
83,"Sick for almost 24 hours now...the amount of chicken soup, kombucha and of course red wine dropped off has been unr…",FALSE,3,NA,3/4/19 3:11,TRUE,NA,1.10E+18,NA,"<a href=\http://twitter.com/download/iphone\"" rel=\""nofollow\"">Twitter for iPhone</a>""",sarahuhran,0,FALSE,FALSE,NA,NA,,,,,,,,,,,,,,,,,
84,"Very nice lady working at CVS looked at me and said, ‘Cody you don’t look so good’ I managed a weak smile, sniffled…",FALSE,73,NA,3/4/19 1:54,TRUE,NA,1.10E+18,NA,"<a href=\http://twitter.com/download/iphone\"" rel=\""nofollow\"">Twitter for iPhone</a>""",TVcody,2,FALSE,FALSE,NA,NA,,,,,,,,,,,,,,,,,
85,"I swear, the epicenter of all diseases plaguing mankind is the kids in my home. #FluSeason",FALSE,0,NA,3/4/19 0:37,FALSE,NA,1.10E+18,NA,"<a href=\http://twitter.com/download/android\"" rel=\""nofollow\"">Twitter for Android</a>""",forewarnedyou,0,FALSE,FALSE,NA,NA,,,,,,,,,,,,,,,,,
86,@target@starbucks your employee at 100 Parsonage Rd was sitting in the customer area and then when I asked where th…,FALSE,0,NA,3/3/19 23:59,TRUE,NA,1.10E+18,NA,"<a href=\http://twitter.com/download/iphone\"" rel=\""nofollow\"">Twitter for iPhone</a>""",mish2378,0,FALSE,FALSE,NA,NA,,,,,,,,,,,,,,,,,
87,This is how I feel. #SickDay #DamnKids #FluSeason #MoreTissuesPlease #TeaAndHoney,FALSE,1,NA,3/3/19 23:57,FALSE,NA,1.10E+18,NA,"<a href=\https://promorepublic.com\"" rel=\""nofollow\"">PromoRepublic</a>""",jennabb,0,FALSE,FALSE,NA,NA,,,,,,,,,,,,,,,,,
88,Jake doing his best to heal Ashlynn. She has been fevering all weekend. Doesn’t want to break 🤒 #101andholding…,FALSE,2,NA,3/3/19 23:21,TRUE,NA,1.10E+18,NA,"<a href=\http://twitter.com/download/iphone\"" rel=\""nofollow\"">Twitter for iPhone</a>""",JMBr00ks,0,FALSE,FALSE,NA,NA,,,,,,,,,,,,,,,,,
90,Not sure about what #InfectionControl precautions you should take during #FluSeason? Dr. Sarah Bell-West has 5 tips…,FALSE,3,NA,3/3/19 23:00,TRUE,NA,1.10E+18,NA,"<a href=\https://www.sprinklr.com\"" rel=\""nofollow\"">Sprinklr</a>""",CloroxPro,2,FALSE,FALSE,NA,NA,,,,,,,,,,,,,,,,,
92,"This has been the worst cold &amp; flu season ever, I swear. Agony. Strep twice, healdcolds, flu, sinus infections, you…",FALSE,24,NA,3/3/19 18:57,TRUE,NA,1.10E+18,NA,"<a href=\http://twitter.com/download/android\"" rel=\""nofollow\"">Twitter for Android</a>""",INFJPhD,5,FALSE,FALSE,NA,NA,,,,,,,,,,,,,,,,,
93,#Moms and #dads.... don't make this mistake: ALWAYS use the dosing device that comes with your child's medicine…,FALSE,3,NA,3/3/19 18:46,TRUE,NA,1.10E+18,NA,"<a href=\http://twitter.com\"" rel=\""nofollow\"">Twitter Web Client</a>""",AnitaBrikman,0,FALSE,FALSE,NA,NA,,,,,,,,,,,,,,,,,
94,@JellyRoll615 liked my response and now I feel like I'm on a high. Being covered this weekend in a 9yr old's vomit…,FALSE,0,JellyRoll615,3/3/19 18:24,TRUE,NA,1.10E+18,34455698,"<a href=\http://twitter.com/download/android\"" rel=\""nofollow\"">Twitter for Android</a>""",MargaritaKellam,0,FALSE,FALSE,NA,NA,,,,,,,,,,,,,,,,,
